[
  {
    "id": 1,
    "name": "Media",
    "description": "Source images, animations and other creative works for the SME Virtual Network and Virtual Chapters.",
    "repo_url": "https://github.com/smevirtual/Media",
    "website_url": "https://github.com/smevirtual/Media",
    "organization_name": "SME Virtual Network",
    "organization_logo_url": "https://avatars1.githubusercontent.com/u/35476746",
    "category": "Infrastructure"
  }
]
